Youtube Corpus 136	https://www.youtube.com/watch?v=5H8M2QPt-Kc
Comment1	End the bbc tax
Comment2	the Never Trump, Never Brexit, Feminist tyranny station
Comment3	the government around the world is a joke...
Comment4	What a joke is this for the whole world to watch. UK became a circus 🎪
Comment5	wonderful - now England and America are entwined in perpetual legal bullshit, England with the EU and we have the Democrats - same shit different smell
Comment6	&quot;Frantic search for a last minute deal&quot; - and there it was all the time on the window sill. Blow the dust off rip out the front and back pages with T.May printed on them and put new sheets in with B. Johnson on - job done.<br />Frantic search over.
Comment7	This is terrible reporting
Comment8	The use of frequencies to inflict manufactured artificial schizophrenia is a human rights crime.The television industry will never brain wash a Republican who wants to see a end to the monarchy,will never change his views.The BBC took with a evil family by illegal access to a British man and have taken his human rights to a wife and children.<br />It&#39;s not a joke ever so face court with your victim.
Comment9	This is where the BBC is at, they are putting Emanuel Macron on a pedestal and shitting on Boris. I can&#39;t imagine how brainwashed and deluded you have to be to actually swallow this crap.<br /><br /><br />Brexit can&#39;t come sooner.
Comment10	Brexit means Brexit , means itself that means nothing <br />No better prospect wi th or without EU for the UK
Comment11	YooKai is back into turmoiiiiil
Comment12	Corbyn could not fix his glasses before the interview? Looks a bit twisted there
Comment13	Nice bit of racism there.
Comment14	EU will never agree to anything because they don&#39;t want England to leave. They fear will grow back into the great empire we once were before the first and second world wars. They don&#39;t want Britannia. They forget we bought the iron industrial to the world and yet treat our country as the doormat of the Europe. They won&#39;t agree to anything unless it benefits them and not us, and they got some of the MPs wrap around their little finger making it harder to leave and come down to a deal.
Comment15	WE WON&#39;T GET BREXIT.<br />The actors we have as poLIEticians are just messing around, wasting time, waiting for some big event to happen so they can cancel it.<br />I feel a war coming very soon, which will be the perfect excuse to shelve the BREXIT idea, because we all have to &#39;stick together in these difficult times&#39;.
Comment16	WE WON&#39;T GET BREXIT.<br />The actors we have as poLIEticians are just messing around, wasting time, waiting for some big event to happen so they can cancel it.<br />I feel a war coming very soon, which will be the perfect excuse to shelve the BREXIT idea, because we all have to &#39;stick together in these difficult times&#39;.
Comment17	For a finale I&#39;d love to see Boris feed the DUP to the wolves. It&#39;s what they deserve.
Comment18	Out /this the deal leave means leave
Comment19	The only thing that will be out 31st October   will be another one of my big loud smelly farts again
Comment20	So a no deal brexit reauires a deal anyone else getting why mr folkes had enough an wanted that place blown up <br /><br />Why did we get a vote ? <br />Ignored democracy anyway <br />1 seeking a deal <br />2 may was unelected twice<br />3 boris unelected <br /><br />Before you expect me listen to any new law id like you to prove your the peoples choice your the peoplss voice but you cannot an shall not so neither will i <br /><br />Far left - far right - war global or civil emd result an its close nation has had enough of brexit immagration govt tax you name it were annoyed an unimpressed by bias media lying an wanting t.v licance for the luxary of qhat selling a lie currupt media brainwashes your kids remember that
Comment21	The DUP probably want another billion pounds to be persuaded, we all know that bribery gets you everywhere. Nothing new from politicians being evasive and secretive.
Comment22	Why is a boarder so bad? It sounds like there has to be one
Comment 22.1	Define <i>&quot;Boarder&quot;.</i>
Comment23	I&#39;ll grab my shovel, happy to help with the search..or burial 👍<br /><br />By Order of the Peaky Brexiters!
Comment24	The dup will render Boris and his deal stupid  come on Arlene  do your stuff
Comment25	people of united kingdom.....if they really want to fix....this problem.....<br />they should in the beginning.....you people been entertain by their deceitful words language that you think that they really cared.....but they don&#39;t cared
Comment26	Looks like we are heading for a No Deal Brexit.... Good. :)
Comment27	This is what happens when you occupy a part of a foreign country!
Comment28	How about FUCK OFF AGREEMENT!!
Comment29	I am so tired to that endless and ridicule Brexit farce and the UK´s national, historical, cultural and political identity crisis around it. The British Empire collapsed soon after the from the UK´s point of view many ways Pyrrhic WWII &quot;victory&quot;, which the Soviet Union and the USA won. In 1989 Germany even won in long term the WWII in Europe when the Iron Curtain and the Berlin Wall collapsed and Germany re-united. Today Germany is increasingly politically, economically and industrially the leading superpower in the &quot;Fourth Reich&quot; EU, which is lika a Phoenix from the ashes of the WWII reborn Holy Roman Empire. Historically then the UK fought the WWI and the WWII in Europe practically because nothing, only because bully nationalistic pride and the UK´s historical outdated Balance of Power-policy that worked centuries well, but turned really disastrous when the 20th century began in Europe that ruined and collapsed the British Empire and the UK position in Europe. Now the many ways confused Britons can´t decide do they want to be officially a Western Province of the Fourth Reich EU or not in future and a part of them fear that though the UK tries to leave the Reich the Reich will never leave the UK in Europe. Anyway God save the Queen and Her Majesty´s Government and Prime Minister and greetings from Northern Europe, from partly arctic &quot;Fourth Reich&quot; EU Province Finland.
Comment30	No brexit is worth having. Hard brexit is dumb, and soft brexit is worse than staying in the EU.
Comment31	he dosent understand england he said ,thats because we dont follow them wagging our tails
Comment32	Johnson is useless &amp; a trump clone
Comment 32.1	Worthless comment.
Comment33	Don&#39;t rush.. Its only been 3 years.
Comment34	"<a href=""https://www.youtube.com/watch?v=5H8M2QPt-Kc&amp;t=0m53s"">0:53</a> this WHAT say? lol"
Comment35	Get rid of the DUP!! Get them out now they are trouble out out out go  feck off to England or just get lost! Holding up everything!!
Comment36	Almost everyone is talking about the border between Northern Ireland and Republic of Ireland. What about the border between Gibraltar and Spain? Gibraltar is also going to leave European Union, together with the United Kingdom...
Comment 36.1	I believe Gibraltar already has a hard border,with security checks and passport control, similar to entering the mainland UK  from Europe.
Comment37	Pisa 💩
Comment38	UK don&#39;t want one
Comment39	Breaking News :- Daily Star to be investigated over front page lies on Tommy Robinson
Comment40	Have anyone seen the upstair  shaking  legs&#39;
Comment41	With the BBC SELLING US OUT TO EU. WHO NEEDS ENEMIES WHEN THERES PLENTY OF TRAITORS .<br />NO MORE TV LICENCE FEE.FOR YOU BUNCH OF TOSSERS
Comment42	If you think the crazy loons of the DUP are going to agree to anything ever you are having a laugh.
Comment43	Fake reasons for brexit: democracy, immigrants, saving millions we send to the EU every week<br />Real reasons for brexit: EU´s legislation on money laundry, tax evasion, users data privacy...<br />I pity the stupid poor right that believes in their &quot;leaders&quot;...
Comment44	Maybe make Northern Ireland it&#39;s own autonomous region.
Comment45	I have a small business in Northern Ireland which like hundreds of others depends on a first class next day delivery of parts from England.  I order today and can have those parts fitted tomorrow.   The EU demands will put me and lots of other small companies out of business due to their internal border demands.   Any internal customs in side the UK will slow delivery of needed parts to several days maybe even weeks.  Then those using Royal Mail will be hit harder as Royal mail charge £8 to collect £2 or £3 on behalf of the inland rev Ie customs.   This plan no balls Boris is willing to agree to will see many jobs lost here in Northern Ireland and in England.  It dosnt even adress the border problem the EU talk about as a company can import from England to Northern Ireland claim it is not for the EU and claim a rebate then sell those goods out to shops etc who sell to any one coming in through the doors  no passports needed.    Those goods can then cross the EU border to the Republic of Ireland.. <br />  Then what about the ordinary Northern Ireland  online shoppers that buy millions a month  from the rest of the UK Boris has no plans to give them rebates and intends to make them pay high EU tariffs and Vat. Meaning the people of Northern Ireland can not benefit from the lower prices out side the EU.
Comment46	The time and the money got spent is incredible. It’s a complete choke.....
Comment47	Uk playing the blaming game :)))
Comment48	Why doesnt the EU do what it demands of the UK. It can put Ireland in a special zone, in and out of the EU. Put a border up between the EU and Ireland with special status. <br />That&#39;s even better that the current proposal because Ireland keeps its integrity and isn&#39;t split<br />Oh I get it, the EU won&#39;t do that. Why should it expect any country to do the same? <br />Tell them to foxtrott oscar
Comment 48.1	Typo.<br /><br /><br />Why should we in the UK pay because Ireland isn&#39;t allowed by the EU to adhere to the GFA?
Comment 48.2	@Lauren Hedman Why should we in the EU pay because Ireland isn&#39;t allowed by the EU to adhere to the GFA?
Comment 48.3	Why should we in Ireland pay for a decision made in Britain by British people? Why should we have to do anything to make this better for ye? Ye voted to leave. So leave.
Comment49	Time for sinn fein to take their seats now, the boris wont need the DUP anyway
Comment 49.1	@Nickle yeah fair point
Comment 49.2	Swear that oath, loyalty to the UK and not Ireland, and the queen
Comment50	Jean-Claude Juncker says &quot;Everyone understands English nobody understands England&quot;.  I understand Juncker in that he pretends not to understand the UK&#39;s referendum results and needs.  A good example of the bureaucrat who values his bureaucracy ahead of serving the people.
Comment51	It has been THREE YEARS! So why the last minute panic? They are like school children doing their homework on the bus on a Monday morning!
Comment 51.1	@General Ripper Spot on!
Comment 51.2	Too true!
Comment 51.3	Because at the end of the day, they all return to their multimillion pound apartments in Chelsea.
Comment52	&quot;Cant be certain about the outcome&quot; - Of course not. Three years of dicking about will obviously lead to uncertainty. Nobody knows much about the deal because the Dog ate it.
Comment53	No one wants a deal!
Comment54	Why didn&#39;t they start getting a deal back in 2016 after the EU referendum, instead of waiting for the last minute?
Comment 54.1	Theresa May started negotiating a deal after article 50 was implemented in 2017. Its just the hardliners in the Tory party didn’t like that deal.
Comment 54.2	MrDhartz <br /><br />They love the lime-light,and to show their power,so they can use their news channels to brainwash you into submission,without you even realising it.<br />Wake up and smell the coffee
Comment55	Ain&#39;t Ever Gonna Happen. Not Now and Ever. The Falsehood of Brexit is Now The Fall Of Britain.<br />Who Would&#39;ve though. <br />Oh Well. Hard Times.
Comment56	Schrödinger&#39;s Brexit
Comment57	No deal
Comment58	WARNING!! USUAL ANTI BREXIT PROPAGANDA FROM THE BBC!
Comment59	Haha good job.....Brexit or Bust.
Comment60	NI votes to stay in EU but England takes them out  (while NI remains part of customs territory for border purposes) cutting them off with a border in the Irish sea.....Seems unfair but perhaps workable.
Comment61	What a bulls up from the start and most of us said it would be. No matter what happens.
Comment 61.1	Yep and these (according to remoaners) are 650 of the most intelligent people in the country!
Comment62	Can&#39;t you stop lying? It is not a deal, it is leaving agreement. Deal has to be made after you leave. Why can&#39;t you get it, BBC propaganda?
Comment63	Corbyn is irrelevant; McDonell is the one running things now, and he is not &quot;asking&quot; the party to oppose a deal, he is &quot;telling&quot; them. However, given that the LibDems new position is No Brexit, and that there are still Tory rebels holding their seats in the House (for the time being, as the next General Election will see an end to them), then there is still a possibility of a &quot;No Deal&quot; Brexit. That would be my preference as it would mean that once free from Brussels control, we would be in a strong negotiating position for trade deals with EU member states, not least the leading one, Germany, which needs to see its exports to the UK continuing.
Comment64	I think they have brought out a container with a series of long and short straws in it so that they can clutch at them
Comment65	What in the world are the EU and the British fighting over? These partners really didn’t have much of a partnership. <br />I thought the US was lame but maybe I didn’t do a very comparative <br />study. <br />Corbin is a complete .....<br /><br />Peace
Comment66	Corbyn in the chemist picking up his incontinence pants.
Comment67	Fuck the english. Say goodbye, you will not be missed
Comment68	slap some brex tape on it.  bam!
Comment69	There is availability of spaces in my institution, first come first served basis.
Comment70	Who would have guessed that 200 years later Britain would impose Napoleon&#39;s Continental System on themselves haha.
Comment 70.1	Big Tex; The old historical the UK´s outdated &quot;balance of power&quot;- policy (partly using the same foreign policy tactics and principles as the ancient historical Roman Empire during its expansion) in Europe still worked against Napoleon and later during the 19th century against the Russian Empire too like it had worked centuries against the Spanish Empire, the Kingdom of France and the French Empire and even against the Holy Roman Empire and the Habsburg Dynasty commonly for centuries. The UK´s old and outdated &quot;balance of power&quot; -policy never worked against united Germany and the German Empire since 1871 and it turned from the UK´s point of view very disastrous when the 20th century began in Europe, because the rising German Empire was practically alone stronger than especially the land army military weak British Empire, the French Empire and the Russian Empire together and only massive scale US military help during the WWI and later during the WWII saved the commonly military weak UK though Germany never wanted to occupy the UK, not during the WWI and not during the WWII. Imperial Germany had achieved during the WWI a massive scale victory against the Russian Empire, which turned to revolution and anarchy after a massive scale military revolt in St Petersburg and Germany wanted only peace with France and the British Empire, which were massive scale supported by the USA and the US Army. Later during the WWII Adolf Hitler actually wanted desperately permanent peace to Europe and to found some kind of his style EU under political leadership of the NSDAP Germany and permanent working peace with the UK and mostly the old Imperial Germany´s borders back in Continental Europe and perhaps too the Imperial Germany´s before the WWI colonies back. During the WWI even the Imperial Germany Navy was practically as strong as the Royal Navy though it had over careful tactic and less war ships because the German war ships were commonly better and more secure than the British Royal Navy war ships, which many times exploded and sank disastrous way during naval battles killing a lot of the Royal Navy crew members. German U-boats were then superior during the WWI. Modern &quot;Fourth Reich&quot; EU is practically like Phoenix from the ashes of the WWII reborn Holy Roman Empire, which was the historical &quot;First Reich&quot; in Europe, which did last about 1000 year since the beginning of the Medieval Era to the Napoleon´s Wars. Nationalism then began commonly to rise all around in Europe, especially in Germany and Italy, because Napoleon and the French military expansion, that failed because the victorious Imperial Russian army, which finally occupied Paris and Napoleon´s France surrendered, that was historically the end of the French Army military success in the world. The French Army´s new military tradition was and still today is to surrender whenever it is possible, just like the Italian Army, lol. By the way the governing capitol city of the Habsburg Emperor Charles V of the Holy Roman Empire was Brussels just like the modern Fourth Reich EU´s governing capitol city. Charles V was too the King of the during his era fast rising Spanish Empire and he ruled the first global European empire ever where the Sun never set.
Comment71	The ONLY Brexit worth having is where we dont kowtow to the EU and divide up our Great Britain!
Comment 71.1	Funny how you think the &quot;kowtowing&quot;, as you call it, will stop after you&#39;ve ejected yourselves from the largest trade bloc in the world right on your doorstep.
Comment 71.2	1 of the countries of ‘our’ Great Britain (Scotland) and N Ireland voted to remain
Comment 71.3	I&#39;m sure that any deal they make will meet your exacting requirements...
Comment 71.4	Nurdhurrrr nationalism
Comment 71.5	Well said Paul exactly my sentiments.
Comment72	EU Visa runs out Schengan Area (signed in the middle of a river?)...? not a problem jump into a non Schengan area... UK or Republic of Ireland<br />..Republic need to send the underwriters in,staying out of Schengan to facilitate Common Travel Area,, but getting Schengan immigration status .is: preventing &quot; Sanctuary City Eire&quot;<br />..thanks
Comment73	People should watch more things that they forbid us to watch in order to understand our current state of captivity. Watch: &quot;Europa The Last Battle&quot; at archive-dot-org. Entire doc banned on YT. Victors write the history
Comment74	A deal means no Brexit - what else?
Comment 74.1	Not necessarily <br />Wait and see ...
Comment75	&quot;Leave then negotiate &quot;man..LOL...
Comment 75.1	Yes leave and then negotiate, some deals have taken decades. Imagine then having to renegotiate over 60 more
Comment76	The deal will be only valid when the parliament agreed. How can a minority government win the vote? Wasted time because there was already a deal before and it was 3 times rejected. Looking forward what happens.
Comment77	They better make this happen, because if they don&#39;t? The next general election for so many politicians will be their last!! <br /><br />Aready have the Popcorn...
Comment 77.1	@Philshki82 yeah that is sadly the truth. Scary thought.
Comment 77.2	Chris Wild <br /><br />The EU will be running your country,because you give up your sovereignty,you are lost to them forever,prepare to lose everything.<br />PS They won&#39;t need most of the politicians anyway,you will be ruled from the central hub Brussels.<br />You are screaming for your own demise,wake up and get out,you will prosper.
Comment 77.3	Yes. The Portillo cases will be legion
Comment78	If the EU like it it means we have been stiffed by yet more consessions<br />Traiterous scum in parliament
Comment79	I say while you&#39;re at it this &quot;Bexit&quot; logic for leaving the EU should do the same for the UN and NATO.
Comment 79.1	Once the EU has its army,navy and airforce I foresee them telling the US and us where to go with NATO....
Comment80	All you brexiteers, you are playing right into Putin&#39;s hands!  Nice job!
Comment81	Have they tried looking down the back of the sofa?
Comment82	The UK have played a blinder. Fooled everyone. lol  Bye, bye EU.
Comment83	Check between the sofa cushions
Comment84	Tell the EU to get stuffed ..we are England , we beat the Reich and we can sure as hell beat a bunch of self serving Belgian nonces.. fuck the EU..
Comment85	Deliver Democracy. Leave the EC, trade on World Trade Terms just like the rest of the world. Meanwhile, these incompetent UK &amp; EU political millionaires can argue and haggle over the next trade deal to line their own pockets. The real winners here are the greasy politicians on both sides.
Comment 85.1	The rest of the world doesn&#39;t trade of world trade terms
Comment86	Europe wanted to stand a conclusion but the only thing is we can only hope for a better future by tomorrow or Friday and then we get the results the EU has got to summit it yet. Because where I from I got Gypsies around at the park setting off fireworks at 10:01pm and got like Immigrant selling drugs inside the park in state as well.<br />It needs to stop.<br />But some of you don&#39;t care for that so why do I even bother telling you lot you the pricks that wanted to fellow Jeremy Corbyn anyways.
Comment87	Free UK FREE HK!
Comment88	But we REALLY want to have our cake and we REALLY want to eat it, too. -Brexiteers
Comment 88.1	Amin Abadmood You know its not only brussel people we are people from many countries like yours? We have have feelings about good and bad with EU. In Sweden first very sceptic no we are all in its the new reality? Like the rules of market? But many people everywhere have goals, and if you get more its like opening the door to endless renegotiations like you are having
Comment 88.2	Better us have it than Brussels.
Comment89	I see Northern Ireland as a <i>customs tax heaven</i><br />Goods from China pouring into the EU without paying any taxes.
Comment 89.1	I&#39;m surprised your racist ass didn&#39;t throw in Russia for good measure. Let&#39;s face it it&#39;s white Brits who will try it on.....your past record agrees with my assessment.
Comment90	Arlene Foster is a WWE male wrestler in disguise
Comment 90.1	Brendan Coughlan lol 😂
Comment 90.2	What&#39;s the disguise?
Comment 90.3	@Robert Barr And when the UDF were murdering Catholics in Ulster she was laughing her ass off, right!
Comment 90.4	When the ira where blowing you guys up in London she was facing them as a true warrior in northern Ireland...
Comment 90.5	Crap disguise.
Comment91	If Brussels are happy with the deal then its happening as they will just tell treasonous remoaners that if they do not vote it through they will not offer an extension. So it will be either this deal or no deal.
Comment 91.1	Hahahaha &#39;treasonous remoaners&#39; you got the whole script by heart Dumbo!
Comment 91.2	Either way would be OK.  Britain does not need them.
Comment 91.3	UK PATRIOT Nobody would be called UK patriot in caps unless a troll.. Surely? You even dropped treason and Remoaner in there!
Comment92	"Oh My God!!!! Pls Pls Watch This! <a href=""https://www.youtube.com/watch?v=WeI7khz6TKE&amp;t=4s"">https://www.youtube.com/watch?v=WeI7khz6TKE&amp;t=4s</a>"
Comment93	"The EU really know how to negotiate, we need practice, my guess is that they won&#39;t give more than an inch just like last time.  <a href=""http://www.youtube.com/results?search_query=%23BrexitMeansExit"">#BrexitMeansExit</a> <a href=""http://www.youtube.com/results?search_query=%23wtoletsgo"">#wtoletsgo</a>"
Comment94	Grieve, Lammy and the other MPs that went to Brussels yesterday for talks should be stripped of their privileges and investigated. If this was a war they would be held for treason.<br />They are a disgrace to the country.
Comment 94.1	But it&#39;s not a war, and they can talk to who the fuck they want.
Comment95	Two things are absolutely sure re BJ&#39;s actions in the next few days: 1) BLAME the EU if no deal comes out of the negotiations; and 2) BLAME parliament if a deal is reached and MPs reject it.
Comment 95.1	@Joe Bloggs. or do you mean the Conservatives who think they speak for Scotland who voted to remain in the EU???  don&#39;t pull that card.  it&#39;s shitty.
Comment 95.2	@Joe Bloggs. oh, you mean like the DUP brex-shit-eers who pretend to speak for the whole of Northern Ireland which voted to remain???
Comment 95.3	@Tony de Castro like all the remain mps who stood on manifestos to get elected then betrayed their electorate?
Comment 95.4	@Joe Bloggs. Boris is a congenital LIAR...
Comment 95.5	Yes, Boris tells the truth. Glad you agree.
Comment96	Aaaaaacttttcchhhoooooo....<br /><br />Sry.. im alergic to bullshit....
Comment97	Question for British: just curious can BJ request a really short extension like a day(or a minute) and exit on technicality
Comment 97.1	No nozim he has to ask for a 3 month extension minimum. But if the EU want a longer extension he has to accept, hence why it&#39;s called the treasonous surrender bill. There is a way out of it and Boris is playing the remoaners fantastically.
Comment98	We voted to Leave!   Over 17 million people Why are our MPs so  damn cowardly? All they do is appease EU  very and over again
Comment 98.1	@michaelthedriver Yeah whatever!!
