Youtube Corpus 36	https://www.youtube.com/watch?v=kPMJZvxsiNQ
Comment1	I wish all the politicians resign and let us live in our country in a good way.we Lebanese do not have money even to buy some food we are all poor I love my country but these politicians need to get the fuck outta lebanon they tried so many times to fail this protestation but we are unstoppable and we will never get out the streets before having what we want I&#39;m 16 years old and I everyday go down to the streets bc it&#39;s for our future the young generation. Stay strong all the lebanese ppl ra7 nentossir ariban chbb 💪💪💪💪
Comment2	Remember how this bonehead was kidnapped and resigned and then retracted? Only a banana republic has a leader like that, Lebanon deserves better.
Comment3	I want translation about this new
Comment4	Lebanon Government to death<br />Ayatollah Ali khamenei to death
Comment5	HELLLAAA HELLA HELA HELA HOO JEBRAN BASSIL KISS EMOU!
Comment6	Kelon YA3NI KELLON!
Comment7	"This is journalism<br /><a href=""https://youtu.be/omb5PAweCrY"">https://youtu.be/omb5PAweCrY</a>"
Comment8	World consumers of Brazilian products: attention. Brazil ends up releasing the application Glyphosate or Roundup in their food and pasture.
Comment9	Political upheavals, rioting around the world, California going up in flames, but the Dems in Washington are too busy with their latest coup attempt to notice. But America is noticing and it will be payback time come November of next year.
Comment10	Trump too has to resign
Comment11	"Head of the BBC the head of ITV please step down and <a href=""http://resign.you/"">resign.You</a> gave a man manufactured artificial schizophrenia you have illegal access to use frequency devices against a railway <a href=""http://worker.you/"">worker.You</a> can exploit but you will not get the victim in a television <a href=""http://studio.you/"">studio.You</a> will face him in court."
Comment 11.1	ok ill bite wtf is this about???
Comment12	THE DEMONSTRATION IS AGAINST WESTERN BACK HARIRI GOVERNMENT
Comment13	EVERY BODY SAY    FECE BBC
Comment14	The &#39;powers of the [political] heavens will be shaken&#39; Luke 21: 25, 26. This &#39;shaking&#39; by Jehovah&#39;s &#39;earthquake&#39; upon the present system Hebrews 12: 26-29 comes at a time of &#39;wrath&#39; manifest Revelation 11: 18 Jeremiah 25: 24- 26. In Q4 of 2019, 25 places of serious rioting and protesting also shows a gradual financial fall that harps back to the FC of 2008. These places of protests are: <br />Spain, Sudan, Russia, Egypt, Uganda, Indonesia, Ukraine, Peru, Hong Kong, Zimbabwe, Colombia, France, Turkey, Venezuela, The Netherlands, Ethiopia, Brazil, Malawi, Algeria, Iraq, Haiti, Ecuador, Lebanon, Chile,  and Guinea.<br />In Daniel&#39;s prophecy of the &#39;iron and the clay&#39; in Daniel 2: 31-46 we see the &#39;iron-like&#39; totalitarian governments and the &#39;clay-like&#39; ordinary people; who want to have a say in matters of government, &#39;are not sticking together&#39;, just as iron is not sticking with clay. These protests and riots create the wrath of nations seen in Revelation 11: 18, along with the outbreak of wars and disorders, also visible. Jeremiah 25: 24-26.<br />Christ arrives like a &#39;Stone&#39;, that strikes the political system, rendering it to chaff upon the wind.Daniel 2: 34. 2Peter 2: 4 This is also seen in Matthew 24: 21, 22, 29, 30. The earthly Kingdom indicated in Daniel 2: 44 corresponds to God&#39;s Kingdom described in Matthew 24: 14; and the Paradise Christ described in Luke 23: 43.<br />The massive change that takes place at this time of wrath; financial meltdown Psalms 46: 6 and the interventions of Jehovah God and Christ Jesus, written in detail in prophecy is the saving and rescue of faithful mankind John 3: 16 Revelation 7:9, 14-17 that results from our Creator Isaiah 45: 18 intervening in man&#39;s affairs to save us from being rendered extinct due to the events of the Great tribulation Matthew 24: 21, 22. &quot;Unless those days were cut short, no flesh would be saved.&quot;<br />As the King of God&#39;s Kingdom Revelation 11: 15, 18  Revelation 12: 10 Christ comes to save all those whom He has already died for in the first century. These &#39;sheep-like&#39; persons Matthew 25: 31, 34 are greatly benefiting from this history written ahead of time by the God of love who CARES ABOUT US.  <br />Evil- doers who are unrepentant and expect to always be evil and wicked are destroyed Psalms 92: 7 bringing the Great tribulation to an END.<br />But meek and righteous ones who love God will POSSESS the earth; and live upon it forever in peace. Psalms 37: 11, 29. John 17: 3. John 3: 16.
Comment15	Daniel&#39;s prophecy in Daniel 2: 31-46 there is &#39;an immense image&#39; that represents the political system. The &#39;feet&#39; of this image, where we are today, are made of iron and clay: &quot; they will not prove to be sticking together, this one to that one, just as iron is not mixing with clay.&quot; Daniel 2: 43.  We see the &#39;hard&#39; elements , the totalitarian political powers are not sticking with the &#39;soft&#39; clay-like elements, the ordinary people, who are demanding a say in matters of government. This is seen in the form of rioting, and large-scale protests. These people are protesting their governments; while they are feeling the effects of a financial distress that is affecting them personally. This financial crisis harps back to the FC of 2008. We see these protests and riots between ordinary people,  and police and military powers, in an increasing number of places. We see it in 25 places in the final quarter of 2019. These are:<br />Spain, Sudan, Russia, Egypt, Uganda, Indonesia, Ukraine, Peru, Hong Kong, Zimbabwe, Colombia, France, Turkey, Venezuela, The Netherlands, Ethiopia, Brazil, Malawi, Algeria, Iraq, Haiti, Ecuador, Chile, Lebanon and Guinea.<br />These &#39;wrathful&#39; events are also associated with the appearance of wars and wrath in Arab states Jeremiah 25: 24 and in Syria and Russia, as the &#39;kings of north near and far&#39; Jeremiah 25: 24-26 strut their stuff in a war in Syria now involving Turkey. The wrath of nations indicated in Jeremiah 25: 24-26 and including Revelation 11: 18 becomes a worldwide crisis.<br />In Daniel&#39;s prophecy a &#39;Stone&#39;, cut &#39;not by hands&#39; strikes the &#39;image&#39; on its feet. This is Christ Jesus 1Peter 2: 4- 8. This &#39;Stone&#39; was rejected by the builders, but was glorious in the sight of God. When the Kingdom is established on earth Daniel 2: 44 this is when Christ the Stone strikes the &#39;image&#39;, making this political image become like chaff upon the wind. This is also the time seen in Matthew 24: 29, 30 when Christ arrives &#39;in power and great glory&#39;, because the political system has been ejected from authority, at the time when Iran bombs Israel. Daniel 11; 44, 45 1Thessalonians 5: 2, 3. Repeated also in Matthew 25: 31, 34 we see the &#39;sheep-like&#39; true Christians are already inside God&#39;s Kingdom when Christ appears. These are faithful ones John 3: 16. The Kingdom in Daniel 2: 44 becomes established earth-wide, when Divine actions bring the wicked to an end. Psalms 92: 7. This is the same Kingdom preached in Matthew 24: 14; and the Paradise Christ described in Luke 23: 43.<br />The time has already appeared for an extinction level event; and the symptoms seen are &#39;wrath of nations&#39; Revelation 11: 18. This time of wrath reaches full maturity when Iran bombs Israel. Daniel 8: 20, 23-25. Daniel 11: 44, 45. This is the occasion when Jehovah will speak Ezekiel 38: 18, 19, and the authority of Christ Jesus displaces the authority of the political system. Zephaniah 2: 1-11. The &#39;desolations&#39; Matthew 24: 15 seen in Israel, mean this has already occurred. Christ rules in earth-wide authority  Revelation 11: 15, 18 and the political system are attracting an execution. Revelation 19: 11, 19-21.
Comment16	BBC fake news since 1922
Comment17	Hezballah🤢🤮🖕🏻
Comment18	<b>Hariri  is gone ,Lebanon  need Nuclear  weapons  from  Iran</b>
Comment19	North Ireland should be one country!  Also the Scotland!
Comment20	would you add the ENGLISH subtitle to all videos
