Comment 98.2	@Johnny Rad Yes! I bet your one of these weak people that would rather fly the flag of the EU than that of your own nation, for you too are a coward that has no faith in our nation! Go fuck yourself!
Comment 98.3	Do any of the 17 million care about any of the 16 million remainers cuz if u don&#39;t then ur selfish cuz all u care about is yourselves
Comment 98.4	17 million out of 65 million people, is not an overwhelming majority
Comment99	Brexit supporters are snowflakes and should be ignored.
Comment 99.1	@michaelthedriver keep dreaming
Comment 99.2	@Nik Naim Norisham it&#39;s not a majority. Of the 33 million who voted yes but not out of the whole 66 million because after 2016 another 2 million voters were then eligible to vote and most of them said they woulve voted Remain so it would&#39;ve been more like 18 million Remain, 17 leave but those 2 million innocent people never got the chance to have their say as well as the 5 million leavers who signed a partition to vote again
Comment 99.3	Still have a majority than your Remoaners. Come on, brexit means brexit
Comment100	Hugh Edwards  -  &quot;A border between Northern Ireland and the U.K.&quot;  Constitutionally impossible Hugh.  There is no U.K. without Northern Ireland.  There&#39;s just Gt. Britain.  Like so many others Edwards equates &#39;U.K.&#39; with Gt. Britain.  Really surprising and disappointing from such a prominent commentator on BBC.  Ironically Edward&#39;s slip - up reflects the long held position of Sinn Fein and the Republican movement who NEVER use the term &#39;United Kingdom&#39; as they also never say  &#39;Northern Ireland&#39;  when referring to the six counties concerned.  They invariably use the term &#39;The north of Ireland&#39; to avoid legitimising British rule in any part of Ireland as they see it.
Comment 100.1	Or maybe not old enough to remember what it was like!
Comment 100.2	jsbart96 you are clearly not Irish!
Comment 100.3	Stephen Devlin not with the DUP it would never happen, we can barely afford the people that are here!
Comment 100.4	Sarah Pitchford not sure if any of those claims are backed up by reality or evidence 😂
Comment 100.5	@Sarah Pitchford plenty of studies to show Ireland would actually thrive as one nation
Comment101	What&#39;s the difference between BBC News and CNN? Nothing fake news! My British brothers and sisters hold it together! Where we go one we go all<br />🇬🇧 + 🇺🇸 together We support    &quot;F R E E D O M&quot;
Comment 101.1	Fuck off U.S!
Comment102	I&#39;ve got a solution for the Irish situation - the British invaders get hell out!!
Comment 102.1	@SEAN INGRAM I didn&#39;t want to perpetuate yet another fake myth about the Irish  - yet reading back your comment about medication was fair, though inaccurate.   <br /><br />Honestly  - this topic upsets me, a lot, people have fought and died for this even before the famine  - <br /><br />people I know and love  - and those I never had the opportunity to meet (shot outside a church on a wedding day - this  - this - THIS - is what the British did to my family  - THIS is why we finally left our homeland  - *THIS*) <br /><br /><br />You married Sean? What would you do if someone came to your wedding with guns killing people you loved  - including the bride and groom? <br /><br />As a person <b>THINK</b> before you answer<br /><br />Justify <b>THIS</b><br /><br />Was my family in IRA? sein Feinn? Nah! anything similar- nah -NO!<br /><br />(AFTER this happened?  (you think we can not get to the bottom of this  - think we are not smart enough to think  was not a false flag (modern concept for American mistakes  -:false flag = &quot;we fucked up&quot;) Truly I do - NOW - this happened well before - <b>innocent</b> people adding a <b>wedding</b> ffs. Influential, educated - outspoken  - <b>outspoken</b> (did we learn to shut up then  - did we leave the country?) <br /><br />(Imsgine - just imagine- thid sctually happened to you, in Britain, this day and age - what would you do??? Alien invasion??? Go to the media???? WHO controls the media???)<br /><br />eading was a wee bit drunk (upset, outraged) the other day. Let me clarify some things. <br /><br />You dont know me or my family. I am 100% Irish on my da&#39;s side - that&#39;s where my irish citizenship is from. <br /><br />As I said before, my mother&#39;s heritage is irish catholic females marrying english protestant men.<br /><br /> I&#39;m not english - though some of my ancestors were  - the ones that left.<br /><br />I am Irish - I&#39;m one of the dispossessed  - a descendant of those that fled  elsewhere. <br /><br />Still an irish citizen  - still have a vote, a voice, a say<br /><br />As I said, you dont know me, you dont know my family. <br /><br />Yes technically I still own some land in Ireland- this has come to me through my father&#39;s <b>maternal</b> line (and through her, directly related to the Kennedys  - simply intelligent, affluent, educated irish catholic are always are threat..)<br /><br />To this day distant family still live on and profit from this land - they dont pay rent, and regardless of what I said we would never actually &quot;reclaim&quot; their home omg the very thought is sickening - what was it you were saying - breaking the back? You dont know me or my family - <br /><br />one of my uncles visited them about 20 years ago ( no, more, my da passed 20 years ago  - this was well before that) - they thought he was there to reclaim the land  - he just wanted to see what his parents had spoken about with such love. <br /><br />Again, you dont know me, my da, his family. My da was asked time and time and time again to serve people, to serve his community, to act as a leader  - he did so (voluntarily, in his spare time) because this was who he was as a person  as a human being<br /> <br />From both family stories from my aunt&#39;s and uncles of their father (my da was one of the youngest, was a teen when their da died) this was partly because of who his father was  - and partly because of who he was, my father, as a man, as a person, as a human being.<br /><br />I know not only from family stories, but from the historical record (which is irrefutable) that my grandfather, his da, was the same way. A leader who gave to his people, his community. <br /><br />I know from the stories my uncles told me of the generations before that this is who we are as a people - the Connells and the other proud Irish families that make up the rest of my ancestry<br /><br />I know that unlike most other cultures to be a leader you were not simply born into the role, you were not <b>automatically</b> a leader because your father happenedto be a leader - as such you might have had advantages - but to actually lead - you had to EARN your place - you had to be chosen to lead, <b>chosen by the people</b> <br /><br />(And not just men  - Celtic women had privileges and DUTIES as leaders too)<br /><br />I can not speak for all my ancestors, I can not say they were without blame or fault. I can only speak to their hearts, mind and spirit as been passed down to me through the stories of my da, my siblings, their parents and the generations before them including the songs my da sang to me and my older siblings,  the songs his grandmother sang to him as a child.<br /><br />You may tell your lies english. <br /><br />The four green fields will be whole one day
Comment 102.2	Julia Connell so as I said previously your family has, for generations by your accounts, persecuted the Irish workers. As you are obviously bouncing around on your medication I will leave you to ponder what generations of your own family did to the Irish workers. Rethink your history and stop blaming the British for the skullduggery your family paid a large part in.
Comment 102.3	Julia Connell lordy your hard work. Firstly, I at no point called anybody stupid, albeit that the Irish can claim injustice and whinge incessantly, around 800 years to be precise. My point on poverty was that both Catholics and protestants suffered equally, as did those on the mainland. You seem to have avoided my observation that Ireland was, and continues to be, a free loading nation. Mostly from the British who they detest so much. As formland requisition, how far are you going back? Because if your going back to the 13 kings then your deluded. What you are now saying is your family was a large part of the problem and not thensolution
Comment 102.4	@SEAN INGRAM oh and catholic &quot;poverty&quot; - you wish!<br /> They had their land (confiscated), some (most?  A fraction? No idea)  clever enough to still own it and pass it onto me and my family - they (the dis possessed) bought businesses in CASH - I have the legal authority  to re-claim.this land any time I chose ( my da  - a lawyer  - and my 2 of my siblings (also lawyers) chose not to. You WANT to think of us as poor and stupid  we are  NOT
Comment 102.5	Julia Connell so your actually saying your not Irish your English?
Comment103	What a load of sham-bollocks!
Comment104	I just dont understand why it&#39;s so complicated...
Comment 104.1	Paperclip <br /><br />The USA has agreed speedily as possible deal.<br />We will prosper and the EU will be a failed bad memory,
Comment 104.2	Andy Johnson  I completely agree. The reason for all this “deal” nonsense is the way the EU chose to implement one sentence in Article 50: “In the light of the guidelines provided by the European Council, the Union shall negotiate and conclude an agreement with that State, setting out the arrangements for its withdrawal, taking account of the framework for its future relationship with the Union.” May should have put divorce/leaving and future/trade together into one new treaty; the so-called “super Canada” trade deal muted by Tusk in 2018 as a model for the UK. Imagine you said to your future wife; first we have to negotiate a divorce settlement, in exact detail, anticipating the marriage doesn’t succeed, lets spend two years doing that. Only once that is signed will I actually propose, and then we can focus on getting married. Not sure too many marriages would take place. Hollande called Brexit “an existential threat to the EU”, their strategy was to ensure it was painful, slow, and UK remained as hampered as possible afterwards: for the UK to flourish would be to light the blue touchpaper: Netherlands, Italy, Greece all ready to jump.
Comment 104.3	Maybe if Northern Ireland was never in the UK you would&#39;ve had ur precious Brexit done a year ago
Comment 104.4	@d s 100% well said, and he&#39;s not the only one. 😯
Comment 104.5	If you don&#39;t understand why it&#39;s so complicated, I wonder what you voted for. If you voted Leave then it&#39;s so clear that you had no idea what was going to happen nor understood what it meant to Leave. So you are just stating your ignorance here, and making clear why the people should NOT have had the choice of voting on such a massive issue.
Comment105	The hard right must not be allowed to get this up without a referendum, which is the first referendum on the real Brexit deal.
Comment 105.1	😂😂😂😂😂😂😂 We&#39;ve already had 2 referendums on eu membership. We&#39;re leaving.
Comment106	NO SURRENDER!
Comment 106.1	R KID it’s not a war dickhead😀
Comment107	Why should the EU give more concessions?! Gimme a break
Comment108	What is Corbyn on about by dropping trump in at the end. Corbyn just makes populist comments left right and centre
Comment 108.1	He doesn&#39;t want a growing economy
Comment109	Shambles!
Comment110	Geriatric Corbyn crapping on about Donald Trump. <br />I wonder if he knows where he lives.
Comment111	Brexit quick and no deal !
Comment 111.1	Hahahaha what a joker! No clue
Comment 111.2	Brexit is a bad idea, ask anyone who goes to college
Comment 111.3	go fuck yourself you russian shill
Comment112	DUP... nice allies.
Comment 112.1	@SEAN INGRAM I will their the fuckin scum of the earth
Comment 112.2	GermanGreetings would you like to extol us with your complaints re the DUP ?
Comment 112.3	they want to have last say on the deal.
Comment 112.4	Tories...nice allies.
Comment 112.5	Beats allying with the IRA.
Comment113	The eu don&#39;t deserve a deal after how we have been treated for 31/2years no deal out
Comment 113.1	@Denis Muthuon so Denis the answer was no then they don&#39;t all pay the same then.
Comment 113.2	@Michael Gardner don&#39;t quite understand your comment, but let me assume you mean UK is the one of the biggest contributor in the EU funding. To be clear about it, Each country pays the same proportion of its national income to the EU budget, so richer countries pay more and poorer ones less. Some countries, such as the UK, pay less because they receive a rebate (the equivalent of UK income tax alowance, due to the fact UK is not fully in the EU scheme) .<br />So you mean that poorer brits (a majority of leavers by the way) as they pay less income revenue to the UK should have a diminished voice compared to the richer (majority of remainers) ?
Comment 113.3	@Denis Muthuon are these the ones that don&#39;t pay anything in lol
Comment 113.4	@Stevo C It&#39;s a trading bloc, and it&#39;s also a political union. There is a long history in the UK of wanting to leave the EU, even the labour leader Corbyn advocated leaving for decades. The idea that the only reason the UK is leaving is because of the leave campaign&#39;s promises is kind of absurd. I say let them leave and if it turns out bad they can move to rejoin.
Comment 113.5	@20,000 Subscribers Without Any Subscribers Well it is a trading bloc, some of the member states would like closer integration beyond just a trading bloc  but most don&#39;t from what i understand. The UK are leaving because sections of the British media and politicians spun a load of lies in the lead up to the 2016 referendum which lead to a close leave vote being the result.
Comment114	Coming up with a draft treaty hours before a summit. Sure guarantee of quality.
Comment 114.1	@The Other indeed.
Comment 114.2	@Rich Mondo <br />I disagree; Brexit has always been about the toffs screwing the plebs.
Comment 114.3	It&#39;s all a sham. Brexit was never about the plebs.
Comment 114.4	Joke really, DUP to rejected and back to square one
Comment 114.5	Yeah, totally agree.
Comment115	At the very least there should be a referendum on this deal. After all, the people will now actually know what they are voting for or against for the first time in the whole fiasco.
Comment 115.1	"@Philshki82 <br />What all 17.4 million thought exactly like you do? Farcical.<br />What 17.4 million were sold.<br /><a href=""https://youtu.be/0xGt3QmRSZY"">https://youtu.be/0xGt3QmRSZY</a>"
Comment 115.2	The Other <br /><br />My difference and the democratic way of the land and has been for hundreds of years,there were 17.4 million people,who thought like me.<br /><br />For the first time in history,Winners are losers in this backward corrupt system!
Comment 115.3	@Philshki82 <br />Don&#39;t worry, we will 😉🇪🇺👍🇪🇺
Comment 115.4	@Philshki82 <br />So your definition of democracy is to restrict the vote to people who think like you do. Brexit in a nutshell.
Comment 115.5	"@Philshki82 <br /><a href=""https://youtu.be/0xGt3QmRSZY"">https://youtu.be/0xGt3QmRSZY</a>"
Comment116	FUCK THE DUP
Comment117	Super Saturday... Bring your baseball caps gentlemen.
Comment 117.1	@SEAN INGRAM The cake is a lie.
Comment 117.2	Paul Rose will there be cake?
Comment118	No matter the deal it will be rejected by Parliament
Comment 118.1	Zepher Gaming Article 51 the Vienna convention,says not my friend,parliament is fxxxxd and rightly so,the traitorous lot they are!
Comment 118.2	Philshki82 Against the law without parliament mate
Comment 118.3	Zepher Gaming <br /><br />Out no deal then!
Comment119	Was that vicky pollard walking with Corbyn? Yeah but no but yeah?
Comment 119.1	Corbyn worried about America but supports terrorists.
Comment120	Excuse me? Did he mean the uk? I&#39;m sick of their racist attitude towards English people, the old drunk.
Comment 120.1	@The Other then why are you having a nervous breakdown on YouTube. Seek help <b>hugs</b>
Comment 120.2	@Joe Bloggs. <br />No we&#39;re not...😂😂😂😂😂😂
Comment 120.3	@The Other what&#39;s this we? You aren&#39;t part of it you aren&#39;t a citizen 😂😂😂😂😂
Comment 120.4	@The Other lol whatever. We&#39;re leaving... Byeeeeeeeeee 😂😂😂😂
Comment 120.5	@Joe Bloggs. <br />We are a political union of two countries and a province. Not a country, anymore than the EU is a country. Is that so difficult for you to understand.
Comment121	Save yourselves from being a slaves of the EU. Your country will be disolved idenities erased with time..
Comment122	Can&#39;t wait for this season 3 finale.
Comment 122.1	@Bettys Closet hope so, cuz that means more protests, more yelling in the House of Commons and heated TV Debates which makes TV very exciting and entertaining
Comment 122.2	I hear they commission season 4 👍
Comment 122.3	@SEAN INGRAM lol😂
Comment 122.4	Matthew Morris I think they all die in the end lol
Comment123	Give up on the brainfart and set about rebuilding the economy.<br />Anything else is madness.
Comment 123.1	@jsbart96 Do you understand the consequences of Deutsche bank&#39;s imminent bankruptcy?
Comment 123.2	Nickle 😂😂😂 imagine being this delusional
Comment 123.3	Walk away, forget this crap negotiation where there is conpromise. It&#39;s a con. Why should anyone agree to a lose-win or win-lose component of a deal? <br />Then you just have deals agreed that are win-win on a case by case basis. It&#39;s easy.
Comment124	If i was eu leader i would say to uk piss off fuck you u wont get nothing blocked everything no deals no place in market if they wana get something double price its like joke watch poor ppl gonna struggle more good luck
Comment125	BBC GO TO HELL
Comment126	"Rule Libtardia<br />Libtardia rules the waves<br />of millions of economic migrants<br />to make of us, slaves."
Comment 126.1	Stick tit football. Leave ruddy news alone.
Comment 126.2	@Ted Crilly To help you thickos......
Comment 126.3	Why do you people never research stuff.
Comment 126.4	@Ted Crilly Europe is fcuked without us.....
Comment 126.5	OK and Europe will do the same to you.<br />And your exports too.
Comment127	Is this real or more bbc speculation based on the credibility of bbc workers?
Comment128	"How do they fix this - no customs border in the Irish sea between Northern Ireland and the rest of the UK? <a href=""http://www.legislation.gov.uk/ukpga/2018/22/section/55/enacted"">http://www.legislation.gov.uk/ukpga/2018/22/section/55/enacted</a>"
Comment129	The Remainers are so angry that he&#39;s about to get a deal, you can see it in thier faces xD. <br /><br />Their whole facade of saving the UK from the &quot;No Deal apocalypse&quot; hinged on Boris not getting a deal either.
Comment 129.1	Those who favour the EU have never had any objective other than stopping brexit.
Comment130	I thought the Referendum was &#39;non binding&#39;? Three years of focusing on nothing else, Parliament in shambles, and now a &#39;frantic&#39; search on how to drag Britain out of EU, deal or not. Mmm.  I&#39;d hate to see how the Tories would have behaved if the Ref had been Binding! This is political blackmail and total BS. Sure, SOME Brits are OK with a no deal &#39;frantic&#39; exit from the EU - most are not and No One VOTED for it. I&#39;ll bow to the majority, as we all must. We have no idea what the majority is in this matter, it appears that the minority are now forcing this BS on everyone and there&#39;s NOTHING democratic in that. This was a non binding referendum and the manner in which we leave the EU needs to be voted on by the British People. Yes, it&#39;s a F&#39;ing mess. But put that mess where it belongs. At the Feet of the Conservative Govt.They had no plan,they still have no plan, they put out a very simply worded non binding Referendum and have never had any clue what to do with the results. And The entire Nation has danced to this BS Conservative Tune for three years. ENOUGH!!
Comment 130.1	Woeld? I take it you’re not a native English speaker. If that’s the case what has any of this to do with you?
Comment 130.2	Yeah they own this shit them and their corporate disaster capitalists media. They sowed it and they growed it and they will reap the rewards of a divided and crisis ridden nation.
Comment 130.3	@Rhodry maelwaedd GB IS the laughing stock of the woeld.
Comment 130.4	The Other what have we got to lose by re sitting every election before the vote has been enacted? Other than the fact that nothing would ever be accomplished, we would be the laughing stock of the world, business would definitely slump due to the uncertainty, no one would ever bother voting as it wouldn’t matter and then parliament would just become an old boys club of the rich, answerable to no one. What have we got to lose? Everything.
Comment 130.5	No one voted for a &quot;No deal&quot; are you having a laugh ? ... maybe one way to find that out would be to ask all the voters who voted to leave what kind of Brexit they voted for. I bet a majority wanted a no deal. And they&#39;d certainly prefer a no deal to a crap deal. But hey maybe that was the agenda all along. At the risk of doning my tin foil hat it wouldn&#39;t suprise me if the Government have been stringing everyone along with this fiasco while secretly wanting us to get poor deal which binds us to the EU indeffinatley.
Comment131	LEAVE THEN NEGOTIATE<br /><br />Brilliant.
Comment 131.1	@baff Baff Enjoy your yellow hammer :)
Comment 131.2	Absolutely.<br />Once out we will learn which things are actually valuable to us and which are not.<br />Makes deals over the problems as they arise.<br />Package deals are dreadful.
Comment132	No deal is brexit let&#39;s get it done.
Comment 132.1	Continued EU membership is brexit. Let&#39;s get it done.
Comment133	"The best lies are based on the truth..<br /><br />Brexit started as a lie, and it will END as a lie !!!!<br /><br /><a href=""https://youtu.be/9q9LpRLsxzo"">https://youtu.be/9q9LpRLsxzo</a>"
Comment134	Send corbyn on a paid holiday ..all should be okay.
Comment135	Vladimir Putin is anxiously waiting for Brexit to happen.
Comment 135.1	Anglo McWhitey that makes you stupid
Comment 135.2	And me.
Comment 135.3	So am I.
Comment136	Britain should not leave the EU..... BRITAIN SHOULD CONQUER AND TAKE OVER THE EU!<br />BRING FORTH A NEW BRITISH EMPIRE! A NEW WORLD ORDER! <br />FIRST THE EU AND THEN THE ILLUMINATI!!!     <br /><br /><br />(subscribe)
Comment137	No deal now
Comment138	Boris Johnson just made Northern Ireland an economic colony of the EU.  Apparently this is called a recovery of sovereignty!
Comment 138.1	Peregrine Slim <br /><br />Not if the Irish don&#39;t agree he won&#39;t.
Comment 138.2	The Other we did, unfortunately you didn’t leave
Comment 138.3	Why can&#39;t Boris do the same for Scotland?
Comment 138.4	Peregrine Slim how do you know that?
Comment 138.5	Part of Ireland,  always was, always will be. Bad decisions elsewhere should not cause problems for them.
Comment139	Leave first, do any deals after. Anything before is just a dodgy deal to try and keep us trapped in it, or an attempt to pretend the Tories have delivered it to stop their party being destroyed by the brexit party.
Comment140	Boris was a Remainer until he realised he had a chance in gaining power if he backed Brexit. Nothing more, nothing less. The &quot;no-deal&quot; facade is to win back voters who deflected to the Brexit Party.
Comment 140.1	@sugarpuffbutty so triggered...
Comment 140.2	Lies
Comment 140.3	@sugarpuffbutty it is legally binding now as it is law we leave at the end of October.
Comment 140.4	Absolutely. It was a non binding referendum which the hard right of the Cons determined they would treat as &#39;binding&#39; the second the result fell in their favour! Johnson and Cons have pushed a NON BINDING vote on Brexit down everyone&#39;s throats for three years. It&#39;s Non Binding, but F&#39;ing Hell - the Cons feed it to us for breakfast, Lunch and dinner every single day! It&#39;s all they talk about. Despite that - they still have NO F&#39;ING CLUE how to do anything! Just talk, and more talk, and rant, and &#39;act angry&#39;. FFS! Enough is Enough. 1)The Ref was NON BINDING 2) No One voted for a No Deal Frantic Exit from the EU.  That&#39;s the answer to three years of pain and disgust. There&#39;s no mandate for any of this Shit from the Cons and never has been. They pander to the hard right Minority at the expense of this Nation - if they&#39;d put half of that effort into Healthcare, Education, Wages and Housing we&#39;d be World Leaders. Instead, they take us all down - if we LET them.
Comment141	BRITAIN SHALL BURN! BREXIT SHALL BURN! THE EU SHALL BURN! THEY SHALL ALL BURN! ESPECIALLY ON HALLOWEEN!                                 And then the Illuminati will be next. (subscribe please)
Comment142	LEAVE NOW NO DEAL.
Comment143	<b>We are No Deal Brexit Britain.</b>
Comment 143.1	Good because the uk will still have our waters fish and that then or borders we can control way befor uk sold our country and the one year after we leave it be all good people over thinknig it
Comment144	"And if you want the truth <a href=""https://youtu.be/EiBZX-TTjAE"">https://youtu.be/EiBZX-TTjAE</a>"
Comment145	No-deal Brexit is the only Brexit.
Comment146	Boris has done everything possible to get a good deal but has so many sides against him.
Comment 146.1	Some of those sides you mention are people who remember the lies of 2016<br />The promise on the side of the red bus stands out for a lot of people
