Comment 146.2	Like the majority of the population.
Comment 146.3	He caused the problem, he gets no thanks for throwing a glass of water on a fire that he started and that has raged out of control for three years. The Ref was NON BINDING yet Tories have treated it like a binding vote from the second they got the results. No one voted for a no deal frantic exit - Tories held a referendum and had no plan how to implement a sensible exit from the EU. NONE. You still praise them? Get Serious FFS.
Comment147	Brexit since June 23 2016
Comment148	Everyone understands English nobody understands England - Jean-Claude Juncker <br /><br />😂
Comment 148.1	@dean 123 <br />Yes, they have some impact on crime figures, but unless you are going for isolationism the cost benefit of prevention is prohibitive.<br />Illegal migrants are concentrated in the cities, safety in crowds. Mostly doing casual work or self employed with a large proportion working in family businesses they are related to.<br />Of course it would be better if legal residents had these jobs, but again the question if cost benefit of enforcement comes into play.<br />As to those work areas where immigrants dominate, they are quite heavily regulated and risky for illegals.<br />As to why native born do not do these jobs; two main reasons: location, the jobs are in areas where there is high native employment and the unemployed are not prepared to relocate; and physicality, the jobs are physically demanding and the native unemployed lack the physical conditioning to take the job on.
Comment 148.2	@The Other would you say they have an impact on crime figures  in the UK and  also if they are working wouldn&#39;t you think it would be better for someone with legal status to be doing the jobs they are doing I also understand a lot of people won&#39;t do these jobs that they do but why do you think that is.
Comment 148.3	@dean 123 <br />They are young, so they work. They pay someone rent, so that gets taxed. Everything they buy that&#39;s vat covered pays tax. If they smoke or drink they pay duty.<br />They make profits for British businesses so corporation tax gets paid on that.<br />They are young, so generally don&#39;t get sick. If they do get sick enough to go to the NHS and are identified they get deported.<br />If they are homeless and hungry, they get treated with the same disdain that our society treats legally resident homeless and hungry.
Comment 148.4	@The Other could you explain how they are positive contributors to the public purse if by nature they avoid contact with the state    and if they avoid the state what happens to these people when they are  ill or homeless or have no food
Comment 148.5	@dean 123 <br />Given that, by their nature, they avoid contact with the state, how do they strain resources?<br />The strains on our society are the result of longevity, not immigration.<br />An aging population of baby boomers tying up the housing market and an ever increasing strain on the NHS and social care provisions are the root of our problems.<br />Even at the top end of estimates, the 850,000 illegal immigrants will be net contributors to the public purse.
Comment149	No Deal Brexit.. Please...
Comment150	We don&#39;t want a reformulation deal we want to LEAVE!
Comment 150.1	Now then now then <br />as it happens, calm the fk down
Comment 150.2	@Sir Jimmy Savile <br />1.5 million of you are dead.
Comment 150.3	@Sir Jimmy Savile   Oh,  I didn&#39;t know that 17,4 million people spoke with one voice on such complicated issue and that you seem to know what all those people were precisely thinking when they voted.
Comment 150.4	@ginlane &#39;We&#39; as in the people who voted to LEAVE in the 2016 membership of the EU referendum
Comment 150.5	Sir Jimmy backs leave. What&#39;s the new slogan? &#39;Nonces for No Deal&#39;? You can stick it on the side of a red bus.
Comment151	Boris has NEVER had any other plan than No Deal. Anyone who doesn&#39;t grasp that just hasn&#39;t been paying attention.<br />The UK is being sold down the river. Comprehensively and very successfully.
Comment 151.1	"@Simon Cheesemonkey This is what is stupid.. A do nothing troll disrespecting those who are working to make life better and their countries stronger... Go kiss Merkel&#39;s ring loser... <a href=""https://www.youtube.com/channel/UCfDa3tJG124ZRrYujU5GLAw"">https://www.youtube.com/channel/UCfDa3tJG124ZRrYujU5GLAw</a>"
Comment 151.2	@WildwoodCastle The level of stupid here is quite remarquable. Trump and Brexit have proved it, the insane are running the asylum.
Comment 151.3	Jack W <br /><br />Well done Boris,good always triumphs over evil!
Comment 151.4	Jack W name me 3 large UK owned companies operating solely in britain? Most of your milk is German produced here ffs
Comment152	No deal please. Letra just leave and charge taxes on foods coming in!!!
Comment 152.1	the goverment have already agreed zero tax on food imports,FACT, but there will be massive tariffs on our exports that is why the national farmers union are going mad at Johnson,he has already sold British producers down the river.
Comment153	For the love of God, end this shambolic shenanigans!!!
Comment154	You know it&#39;s bad when JRM sarcastically says it&#39;s going marvelously
Comment 154.1	In investing being against the market can work, let&#39;s see about Brexit
Comment 154.2	@Philshki82 You&#39;ll see what&#39;s going bad for everyone when the Brexshit hits the fan. Except the very well off you been tugging the forelock to, Mr Muggins!
Comment 154.3	Barlines and Powerfines        Hath not a Jew eyes?
Comment 154.4	@Keen On Deen Like the Roman, I see the River Tiber foaming with blood.
Comment 154.5	Those who God wish to destroy they first make mad
Comment155	Brexits happening<br />It’s not<br />It is <br />it’s not<br />It is <br />Definitely is<br />It’s not anymore<br />It my happen <br />It’s happening <br />It’s not
Comment 155.1	BrownBearBoxProductions exactly! 😟😣😣
Comment 155.2	They should have just rolled a dice, LoL!
Comment 155.3	I wont go so far as to say I&#39;ll bet my left nut it wont happen, but I&#39;ll bet half my left nut.
Comment 155.4	Schrödinger&#39;s Brexit
Comment 155.5	Free UK HK supports our bro
Comment156	Obvious no one wants to concede so stop the bull and let&#39;s just leave
Comment 156.1	stop the bull and let&#39;s just not leave
