Youtube Corpus 122	https://www.youtube.com/watch?v=7G5oglzYL10
Comment1	.The gutter bbc and rotten to the core 2 Party system, along with its Treasonous Political class, along with 80 % of the UK Media and the the house of snakes its all over for their Orwellian, Deep State, Illuminate agenda and their reprehensible philosophy, its like watching a snakes that have swallowed their own poison/venom, they writhe and twist before the inevitable..Vote BREXIT Party at the next GE.... DRAIN THE SWAMP
Comment2	Where the fuck is guy Fawkes when we need him most.....
Comment3	let votes , and get out
Comment4	pifff OdOr ,Brexit means brrrexit ,both mean nothing but a filthy OdOrous  falseflag  show betrayal of European Identity ,means a betrayal to the traitor
Comment5	BBC ,why don&#39;t you like democracy?
Comment6	Well if they extend the deadline again or sell us out I hope the 17 million betrayed finish what Guy Fawkes started on November the 5th 😂😂 Civil war brewing?
Comment7	In the near future, when NI and Scotland will be part of the EU, this brexit referundum plus 3 1/2years MPs circus will make history. It will help pass a law on that voting prevelages should only been given to people whit a certain level of IQ and or education, and a second one on politicians being free of any colusion and be legally responsible for any lie/omission given to their constituents. This to avoid committing such suicidal mistake again...
Comment8	Not just will Scotland inevitably leave and at some point be accepted by the EU as a member state, followed later by Wales, also NI will finally join Ireland. <br /><br />People in England meanwhile, will be split down the middle, will stop saying sorry to anybody who bumps into them, will have to give up drinking port and good wine, get drunk on cheap holidays in Hull and Bristol instead of Ibiza and Cannes, go to do-it-yourself hospitals, look at oranges in paintings in galleries to remind them,  shop in 10-pound shops (formerly pound shops), forced to hang Fartgarbage&#39;s portraits in their living rooms, wear only blue double-breasted blazers with beige pants, brown shoes and white socks, pretend that crooked teeth are the latest thing, close down their airports and souvenir shops, and wave a Coronation mug at their starved bulldogs.
Comment9	How does our population go from 66 million now to only 15 million in 2025?<br />@t<br />Similar figures are projected for other western nations.@t
Comment10	How does our population go from 66 million now to only 15 million in 2025?<br />@t<br />Similar figures are projected for other western nations.@t
Comment11	Wanna  STOP   Brexit<br />Vote  for  The  Brexit  Party<br />let in labour + the liar dems
Comment12	Boris chances doesn’t look promising. Oops
Comment13	Regardless of the vote outcome I&#39;m sure the scheming remainers will concoct some new imaginative way to try to block us leaving!
Comment14	&#39;&#39;A Great new deal&#39;&#39;? Bojo trying to sound like Trump. Lame. The day we all get a chance lets vote this clown and his cirrcus act out of office. He is a cheat, he sold us out. You want 5 more years with this clown in #10 throwing his weight around?
Comment15	What is all that punching in the air? Is Boris at a football match?
Comment16	For everyone who thinks that not choosing this deal = “No Deal” ... you wrong, for no deal must be Separate vote, if they not choose deal today we will have Extension ( if EU allow )
Comment 16.1	Denis Muthuon And I don’t blame them, UK act like spoiled kid who use parents car, credit card and house on tropical island but still shouting at them that he want more and there was a time that he had more 🤣
Comment 16.2	But EU does not allow it. No more, they are fed up with UK mess.
Comment17	No deal
Comment18	we bled for you in africa, europe, asia, we bled for 30 years of more less civil war, &quot;our only crime? being too loyal and for that we are kicked&quot; (lord carson 1922) please for the love of our country and yours vote this down or the u.k. is doomed
Comment19	"If you want the truth of how bad Boris deal is <a href=""https://youtu.be/9jc8Ca_KJac"">https://youtu.be/9jc8Ca_KJac</a>"
Comment20	Does PM Johnson&#39;s deal allow other European countries to fish in UK waters?
Comment 20.1	@Flu Virus have to say, in 50 years from now, shall UK wants to conducts business/export with Europeans they still will have to follow EU regulations, unless UK swap EU near market with US far away market and therefore will have to comply with US standards and compete with Asian and Indian prices thus lower employees standards... that&#39;s the down side of globalisation. What did you think?
Comment 20.2	@Zhang Ruyi But the remainers don&#39;t want a no deal so might vote for it. The UK will enter a transition period when it leaves the EU. During the transition period the UK won’t be a member of the EU but will still have to abide by its rules. For example, the UK would still have to contribute to the EU budget until 2020 along with paying for any other financial commitments made as an EU member.
Comment 20.3	@Flu Virus If this is the case, then what is the point of supporting a surrender treaty? It is better to leave with no deal. However, the remainer MPs will not allow for this to happen. They do not allow for a GM. So, the only option is to extend, which the EU has said they would not allow, and go out eventually with no deal, perhaps after a GM. <br />Does this mean that the UK will be a vassal state of the EU if the deal is approved?
Comment 20.4	Zhang Ruyi The eu will still have laws over us, the deal is not brexit.
Comment21	typical BBC bias ... the result of the vote will go against .. so stop fudging the numbers and be honest for a change.
Comment 21.1	@Electric avenue Bikes That went dark quickly. That sucked for them to be treated so poorly...
Comment 21.2	BBC is honest and in war my family were listing  to the news ,before the germans took them away .and   kicked them hard in the face and ears . until they could not hear or speak no more ,so go fuck off.
Comment22	What a rank and utter nonsensical analysis.. The BBC has raced its way down to the bottom of relevance....  Could it be possible that the conservatives themselves rebel and vote with the opposition?
Comment23	Bojo evil viral deal ..No No No to Bojo treason  deal.
Comment24	From Emannual Macron&#39;s comments that France no longer favours any further extension to the Withdrawal Agreement, it seems to me that Boris may have convinced Macron secretly some time back to countenance no further delays if the EU and UK managed to agree a new deal. That is why Boris has steadfastly stated that the UK will leave the EU on the 31st Oct knowing that if a new deal was not agreed in the U.K. parliament and he was forced to seek an extension, the U.K. would crash out anyway due to a FRANCE veto on an extension. I wonder what the quid pro quo is, and if true it&#39;s a master stroke of strategy on Boris&#39; part.
Comment25	Now there’s a thing they say members of parliament attention span is down from 12 seconds to 3 seconds this is less than the 9 second attention span of of the average goldfish?
Comment26	Why do the BBC put either ugly or fat women on breakfast? Who wants to see that grosse Ness first thing in the morning
Comment27	The unification of Ireland , proposed clearly by this &#39;&#39;deal&#39;&#39;,  will make Indyref2 a certain NSP win.<br />The destruction of the union is just months away.
Comment28	😐
Comment29	"This past week, an employee of a Serbian arms manufacturer was arrested and thrown in jail  after blowing the whistle on a covert US DoD and Serbian contractor trafficking weapons to ISIS in Yemen - a story exposed by Bulgarian investigative journalist Dilyana Gaytandzhieva. Watch our report below. For more information on Dilyana&#39;s story, go to: <a href=""http://armswatch.com/"">http://armswatch.com</a>"
Comment 29.1	@Fonzie . Please share this info
Comment 29.2	Thank you for real news, BBC is incapable of truth.
Comment30	Well then if they don&#39;t back this deal then NO DEAL is the only option 😊
Comment 30.1	That is what we  voted for, to leave. Deals can be done after.
Comment31	The world is anxiously waiting. I am watching Victoria and Gonorrhea Abdul and eating popcorn. We need more movies like that.
Comment32	Fake news scum peddling B.S again
Comment33	So sick of Brexit now, just needs concluding......
Comment34	Let hope those Gravy train riders in parliament vote for Boris brexit deal and get this done<br />Then have a GE and see off   Labour Party and the leader Corbyn and he&#39;s cronies
Comment 34.1	The Fonz <br />To be honest voting for the deal or not let just get it done and leave, <br />Has for Corbyn he and he&#39;s cronies will destroy this country and I long to to see the back of him  and the limp Labour Party has it stands
Comment 34.2	Let&#39;s hope they vote against and we leave with no deal, labour&#39;s demise will be the same.
Comment35	The people said leave,<br />the queen said leave,<br />the prime minister said leave,<br /> ... the MPs will do the right thing for their country.<br /><br />The world is tired of this brexit nonsense
Comment 35.1	It is like drinking rain water at 7:34 am
Comment36	200 years ago Indians should have prevented the illegal British from landing up on the shores of India and this could have prevented these thieves from looting 45 Trillion pounds from India. What goes around comes around,  At Least KARMA is catching up with great Britain and just in a few decades Islam is going to take over Great Britain.
Comment 36.1	Sanjay Shetty <br /><br />🤣 what planet are you on 🤣
Comment37	How come no NEWS about London protest?
Comment38	Will we learn anything new?  Continuity says not.  Can&#39;t trust him, but you can trust him to be him.
Comment39	Stop taking my money you Tyrants!
Comment40	😂😂😂😂😂
Comment41	600 plus parasites in Westminster with a different ,bought and payed for agenda to that of the voiceless  17 million + majority winners of the referendum! Now even the very illusion of democracy is shattered..  VOTING : A POINTLESS EXERCISE IN the puppet UK &amp; Totalitarian EU .
Comment42	It&#39;s a stitch up the EU set this bull shit up
Comment43	Could someone explain how it will effect workers’ rights and consumer protections exactly? The British parliament will be held accountable for these, they will implement the laws, correct? So, if workers right are abolished or radically changed negatively and there are unsafe products on the shelves can&#39;t the people just vote in another government that will return and or improve both worker and consumers rights or standards? Consumers can also choose what they do or do not consume. I just don&#39;t understand this argument in relation to leaving the EU. In theory the voting public should have more control over this not less after leaving. This is a serious question, explain it to me.
Comment44	Only vote we want is a ge to get rid of this entire parliament and elect the brexit party
Comment 44.1	I would love to see the brexit party in power. I would be so funny 😂
Comment45	&quot;....the UK left the EU on the 29th March 2019 by default as there was no valid or lawful impediment to prevent it.&quot;<br />-Stanley Brodie QC
Comment 45.1	Sure mate. 🤣🤣🤣
Comment 45.2	That’s nice, but if no one is listening, what’s the point?
Comment46	oh shit here we go again
Comment47	Took their time
Comment48	It&#39;s hard to over-estimate the importance of tomorrow&#39;s vote in Parliament. The result is on a knife-edge.<br /><br />But it&#39;s clear to me that there is nothing in this Brexit deal to benefit our country. It will leave people worse off, jobs harder to find, businesses struggling and a race to the bottom as environmental and social standards are dumped.<br /><br />It looks like a huge con on the British people because, if the vote succeeds, it will take us into a short transition period - giving people the completely false impression that there will be no impact on living standards, or workers’ rights and consumer protections outside the EU. Boris Johnson will doubtless use this opportunity to try to win an election and put in power a hard-right government which will then run down the clock to the end of the transition period so we end up leaving with no deal. One of the Conservative hardliners has already admitted that this is the plan.<br /><br />Theresa May used to say &quot;no deal is better than a bad deal&quot;. This deal is both: a bad deal with a no deal hidden inside.<br /><br />I plan to speak both in the debate, and at the People&#39;s Vote rally outside. I hope you can be there.<br /><br />(Caroline Lucas - Green MP for Brighton)
Comment 48.1	@Truck Taxi poor mentality.   The only reason why &quot;you want this over&quot;  is because its taken too long.    Thats like you getting a heart surgery, but want to leave the hospital after inadequate work, because its &quot;taking too long&quot;    fool.    U do realise that people including yourself could potentially be HEAVILY impacted by this deal.   Living standards are hard enough as it is :/
Comment 48.2	@Truck Taxi we will leave but not with this shit deal
Comment 48.3	Leave for the sake of your country enough is enough with this brexit nonsense leave already
Comment49	​FREE SCOTLAND AND NORTHERN IRELAND FROM UK!!! THEY WILL LEAVE SOON. AND UK WILL COLLAPSE SOON TOO.
Comment 49.1	WHAT WILL YOU DO WITH THE ROYAL FAMILY? PLEASE,PLEASE,PLEASE., DON&#39;T SEND THEM HERE TO AUSTRALIA. WE ARE ALREADY FULL OF USELESS, FREELOADERS. .
Comment50	NO DEAL BREXIT.<br />Respect the people, you BBC totalitarian swine.
Comment51	GOOD BYE BORIS <br />HOPE THERE IS ROOM FOR YOU, IN TUSKS SPECIAL PLACE
Comment52	Muppets in politics at it again
Comment53	GOOD BYE BORIS <br />HALLO NIGEL, <br />GOD CHOSEN ONE ➕ <br />A LEGEND
Comment 53.1	Clearly, you&#39;re on powerful medication
Comment54	GOOD BYE BORIS <br />A LIAR AND A BULLSHITER <br />YOU THINK WE ARE ALL STUPID
Comment55	HALLO BREXIT PARTY <br />GOOD BYE CON PARTY <br />GOOD BYE LABOUR PARTY <br />FUCK YOU BOTH <br />NIGEL FARAGE FOR PM 🇬🇧 🇬🇧 🇬🇧
Comment56	THE BBC SHITHOUSE SHOULD BE ABOLISHED, ITS OVERFLOWING WITH SHIT <br />STOP PAYING THE LICENSE, <br />SHEEP 🐑
Comment57	The bbc is still protecting that pervert prince Andrew. Disgraceful behaviour.dont let them get away with it keep the pressure on them
Comment58	the EU were desperate so accepted any deal, Boris gave them a deal and knew they would take it...smacks of desperation so probably won&#39;t pass in the house of commons... but remember no deal is better than a bad deal, and respect the referendum..
Comment59	BoJo said from day one since he became pm that he wants a deal with the EU, why would anybody expect any other outcome
Comment60	Thanks for clearing up what abstain means. 🙄
Comment61	to all EU gangsters traitors and fake media the British have spoken leave means leave
Comment62	This is not the time to cheer or throw stones. The referendum passed in 2016 by 52%. Now it&#39;s down to the wire and we don&#39;t like the new deal. We can take potshots at the conservatives in the next election but now is the time to take this seriously or the UK economy will be in a shambles for the next decade.
Comment63	<b>Johnson&#39;s Brexit deal    New snap poll by YouGov.  Some 41 per cent of the people polled said they want Parliament to pass the deal, while only 24 per cent said they didn&#39;t</b><br /><b>So, those in favour of the deal outnumber those against by 1.7 to 1. Support for passing the deal rises to 67 per cent among those that voted Leavers and</b><br /><b>71 per cent of Conservative voters in the poll support Johnson’s deal.  Any MP voting against Johnson&#39;s deal runs a massive risk of losing their seat at the forthcoming General Election</b>
Comment64	Just can&#39;t wait for this!
Comment65	ffs in or out, black or white cut the bs for pumping stocks
Comment 65.1	what socks
Comment66	Speaker Bercow met Members of the &#39;Momentum&#39; Group of Labour MP&#39;s and was inducted into the SS (Special Section) even though he is JEWISH....He addressed the SS with the words..&#39;ARE YOU READY ?..READY FOR TOTAL WAR.???......
Comment67	It&#39;s not a deal, it&#39;s a treaty &amp; a shit one at that.<br />The idea that the EU won&#39;t give another extension, if we refuse this treaty is absurd &amp; everyone knows it.<br />If this treaty is rejected we will end up with an extension &amp; I am guessing an election.<br />One thing to be said in favour of the treaty is that it does get us out of the EU, no more extensions, no second referendum &amp; no fear of article 50 being revoked to put us back to square one.<br />Scrapping this new treaty at a later date, would be a far simpler affair than Brexit.
Comment68	TIME TO RIOT PEOPLE OF THE UK
Comment69	What the F is the matter with everyone? The Eu wont budge too much, the imbeciles in parliament dont want to leave without a deal, Boris has got a deal but people are not happy. So we will leave without a deal ffs
Comment70	"UK Column News - 18th October 2019: Brexit without the Exit<br /><a href=""https://www.youtube.com/watch?v=v4UWd3rYCN4"">https://www.youtube.com/watch?v=v4UWd3rYCN4</a>"
Comment71	Yes, Boris Johnson knows how to surprise! Despite the fact that he adopted “kamikaze tactics” and resolutely led the country towards a hard Brexit, at the last moment the Prime Minister of the United Kingdom was able to find a compromise with EU leaders. The transaction was announced in the morning of October 17, and in the evening of the same day it was approved by the EU summit. Now the final word is for the British Parliament, where Johnson’s coalition partners have already rejected the deal. However, help to the Prime Minister may come from Her Majesty&#39;s opposition: up to fifty members of the Labor Party can support the agreement.
Comment72	A &#39;fake&#39; deal till the end of 2020. They are experts in put &#39;fake&#39; laws. Is not enough 10 years of Tories??Nhs, foodbanks, knifecrime, education, housing.. In everything they have failed
Comment73	The only way to sort this out for once and for all is to had another referendum with two options :leave with this deal or remain. Simple enough,
Comment74	Ww3 will be triggered soon to put us back in Europe and all this will be scrubbed from history soon!!
Comment 74.1	@hatching draggon only time will tell Turkey and Russia on a push through Syria!! Soon the Saudi&#39;s will be attacked!! And Poland will play a big part in the trigger aswell as Japan and China! Wait and see!!
Comment 74.2	:drool:
Comment75	Brainwashing bullshit channel
Comment76	There will be no deal, there will be no Brexit<br />The strongest men (Bercow &amp; Corbyn) want to revoke Brexit and the rest of the parliament are nothing but a bunch of idiots<br />Yes the UK could stay in the EU, but needs to be learned a lesson
Comment77	Boris Johnson has done it again .its  a NO DEAL
Comment 77.1	@Fonzie I do, at least to the extent that there are many factors which influence democracy, where we disagree is whether the two are mutually exclusive.
Comment 77.2	@Des Oliver Sounds like you agree with me lol
Comment 77.3	@Fonzie Many politicians write for newspapers, Boris Johnson began his career as a Journalist. There is a list complied online of the decades of anti-EU stories released by the tabloid media over the years, and as you rightly said, the media has a significant impact on changing perceptions too. This is why the information to emerge from the Cambridge Analytica scandal (targeted data harvesting) posses such a threat to democracies all over the world. I&#39;m glad you agree with me :)
Comment 77.4	@Des OliverLike the continual media bias which will influence more people than mp&#39;s worthless words.
Comment 77.5	@Fonzie If your claim is &#39;both sides lied&#39; then by your own admission, the public was in even less of a position to make an informed decision. <br /><br /><br />To which claims are you referring?
Comment78	The country doesn&#39;t want the European Treaty, but to just leave!
Comment 78.1	@Flu Virus you are leaving the eu with this deal
Comment 78.2	@Si Dog Ducati Democracy
Comment 78.3	Si Dog Ducati Because the deal is not brexit, we voted to leave the eu.
Comment 78.4	Ermm how have you come to that conclusion?
Comment79	What if he doesnt get the required votes? Wuld the extention be given by EU or no deal will be done by PM?
Comment 79.1	@mudasir khan that law doesn&#39;t prevent the PM from allowing a no-deal Brexit, it just means he has to ask the EU for a delay until January if parliament doesn&#39;t approve the deal. However, because the EU doesn&#39;t want to allow another delay, it means that the EU might force a no-deal Brexit by kicking us out if this current deal doesn&#39;t pass.
Comment 79.2	@hatching draggon what about the law passed preventing PM from a no-deal brexit? Is it still in effect?
Comment 79.3	The President of the European Commission has said no extension will be granted. If this deal doesn&#39;t go through it&#39;s very likely that a no-deal Brexit will take place. The opposition members would actually be wise to vote this through because it&#39;s far better (for them) than a no-deal.
Comment80	If they pass Boris deal they would be disgraced considering the deal is far worse than the deal PM May had negotiated
Comment 80.1	Any deal is betrayal.
Comment81	Boris is Fecked .....roll on Saturday Night ....Big Celebrations ..... ✋🏼🤚🏼
Comment82	Oooh ,YooKaii is in turmoilll :)))
Comment83	The UK will slide back into the filthy dump it was before the EU directives forced it to clean water standards, clean beaches and decent health and safety. When we leave the EU we go back to the filth, endless recessions and misery of the 70s....
Comment 83.1	@Marilyn Sagorthe UK will be too busy dissolving to be involved in any of that expensive tech stuff... Never mind AI or techno, you need to think about sovereignty and The Queen. 🇬🇧🇬🇧🇬🇧🇬🇧
Comment 83.2	Agreed....but worse. We will be sidelined into a techno world of AI, 5G, forced fed vaccinations and ruled with penal force.
Comment84	Anything’s better than the evil, silly and dangerous Labour Party
Comment 84.1	@K M D 123 Both the Tory Party and the Labour Party have  dangerous, or maybe a better of way of saying it, two Looney extreme  leaders, Johnson and Corbyn.
Comment 84.2	Owain Garside the Tory party is nowhere near as dangerous, evil and silly as the Labour Party
Comment 84.3	I know, we can have the evil, silly dangerous Tory Party instead.
Comment85	If I was Prime Minister like Boris rn an the deal is defeated I&#39;d either declare a national emergency or porogue parliament again
Comment86	No impact assessment until after.
Comment 86.1	They know what the reports findings will be, they won&#39;t release it.
Comment87	I hope someone producers would be so inspired to get these Parliament intrigues into BoJo Brexit movie
Comment88	Even of labour think the deal is alright they can&#39;t vote for it, thats like saying yea u did a good job we were wrong so will probably abstain in protest or vote no deal an try to delay...again.
Comment89	"get Brexit done...<a href=""https://www.youtube.com/watch?v=v5Pt1YSdISw...please"">https://www.youtube.com/watch?v=v5Pt1YSdISw...please</a>"
Comment90	Do people prefer liberalism or conservatism more?
Comment91	"<a href=""https://presscore.ca/vaticans-nazi-german-fourth-reich-established-under-the-guise-of-the-european-union/"">https://presscore.ca/vaticans-nazi-german-fourth-reich-established-under-the-guise-of-the-european-union/</a> Read this"
Comment92	"<a href=""https://youtu.be/pvZzb_hd6wo"">https://youtu.be/pvZzb_hd6wo</a>"
Comment93	Let DEMOCRACY REIGN, freedom of speech, Integrity, Justice, Morals, Ethics, Religious Freedom, the right to choose-free will, Human Rights, Reformations of the Constitution, honesty in judicial inquiry, honesty reporting in the Freedom of Information Act, Respect for our Citizens, Honour restored back into our Honourable Governing Systems. The future of Great Britain and it&#39;s loyal Citizens like myself is of importance, Democracy Reigns, God bless, PEACE.
Comment94	Scrap the BBC TAX NOW..🏴󠁧󠁢󠁷󠁬󠁳󠁿🇬🇧🏴󠁧󠁢󠁷󠁬󠁳󠁿🇬🇧🏴󠁧󠁢󠁷󠁬󠁳󠁿🇬🇧🏴󠁧󠁢󠁷󠁬󠁳󠁿
Comment95	FUCK the BBC
Comment96	Brexit wont be allowed to happen. There will be 5 more referendums until a rigged &quot;Remain&quot; vote is Democratically obtained 😂
Comment 96.1	Finally someone made a truthful comment , I saw this coming months ago 👍
Comment97	Hi,folks . Everyone  is tired,leave the EU without a deal
Comment98	"Bring back the British system of weights and measures!! <a href=""https://en.wikipedia.org/wiki/Imperial_units"">https://en.wikipedia.org/wiki/Imperial_units</a>"
